{
  "$schema": "schemas/governance-manifest.schema.json",
  "schema_version": 3,
  "pack_version": "4.1.0",
  "entrypoints": [
    "AGENTS.md",
    "GEMINI.md"
  ],
  "project_profile": "PROJECT-AGENT-PROFILE.md",
  "project_profile_template": "templates/PROJECT-AGENT-PROFILE.md",
  "unified_delivery_fields": [
    "Task outcome",
    "Release readiness",
    "External action",
    "Risk and routing",
    "Changed files",
    "Key decision",
    "Checks run",
    "Not verified",
    "Residual risks",
    "Human approval required"
  ],
  "task_modes": {
    "answer": {
      "description": "Explain or answer without changing repository artifacts or causing external effects.",
      "allows_repository_changes": false,
      "allows_external_effects": false,
      "required_signals": [
        "durable_task"
      ]
    },
    "review": {
      "description": "Inspect and report findings without changing repository artifacts or causing external effects.",
      "allows_repository_changes": false,
      "allows_external_effects": false,
      "required_signals": [
        "durable_task"
      ]
    },
    "diagnose": {
      "description": "Determine cause and gather evidence without implementing a fix or causing external effects.",
      "allows_repository_changes": false,
      "allows_external_effects": false,
      "required_signals": [
        "durable_task"
      ]
    },
    "design": {
      "description": "Produce a decision, specification, or plan without changing repository artifacts or causing external effects.",
      "allows_repository_changes": false,
      "allows_external_effects": false,
      "required_signals": [
        "durable_task"
      ]
    },
    "implement": {
      "description": "Create or change repository artifacts, verify the result locally, and stop before external or shared-environment effects.",
      "allows_repository_changes": true,
      "allows_external_effects": false,
      "required_signals": [
        "durable_task",
        "implementation_task"
      ]
    },
    "operate": {
      "description": "Perform a specifically authorized operational, shared-environment, external, or release action without changing repository artifacts; operation-time edits require a separate implement-mode cycle.",
      "allows_repository_changes": false,
      "allows_external_effects": true,
      "required_signals": [
        "durable_task",
        "operational_action"
      ]
    }
  },
  "risk_order": [
    "trivial",
    "standard",
    "structural",
    "critical"
  ],
  "confirmation_order": [
    "none",
    "explicit_authorization",
    "fresh_confirmation"
  ],
  "status_namespaces": {
    "claim_certainty": [
      "VERIFIED",
      "INFERRED",
      "ASSUMED",
      "UNKNOWN"
    ],
    "requirement_status": [
      "APPROVED",
      "CANDIDATE",
      "UNKNOWN"
    ],
    "finding_severity": [
      "BLOCKER",
      "WARNING",
      "NOTE"
    ],
    "gate_assessment": [
      "PASS",
      "FAIL",
      "UNVERIFIED",
      "N_A"
    ],
    "evaluation_result": [
      "PASS",
      "FAIL",
      "INVALID",
      "ERROR",
      "PARTIAL"
    ],
    "task_outcome": [
      "COMPLETE",
      "PARTIAL",
      "BLOCKED"
    ],
    "release_readiness": [
      "NOT_ASSESSED",
      "READY",
      "PARTIAL",
      "NOT_READY"
    ],
    "external_action": [
      "NOT_REQUESTED",
      "AWAITING_AUTHORIZATION",
      "BLOCKED",
      "PARTIAL",
      "EXECUTED",
      "FAILED"
    ]
  },
  "policy_clauses": [
    {
      "id": "mode-bounds-actions",
      "owner_path": "GEMINI.md",
      "summary": "Task mode limits allowed actions; it does not grant authority or expand the requested scope."
    },
    {
      "id": "workspace-preservation",
      "owner_path": "rules/agent-operation-safety.md",
      "summary": "Inspect current state and preserve unrelated user work before local mutation."
    },
    {
      "id": "local-execution-safety",
      "owner_path": "rules/agent-operation-safety.md",
      "summary": "Resolve a repository command and its filesystem, network, credential, cost, and target effects before execution."
    },
    {
      "id": "evidence-scope",
      "owner_path": "GEMINI.md",
      "summary": "A check supports only the property, artifact, environment, and time it actually observed."
    },
    {
      "id": "delivery-status-separation",
      "owner_path": "GEMINI.md",
      "summary": "Task outcome, release readiness, and external-action status are independent claims."
    },
    {
      "id": "unknown-requires-full-route",
      "owner_path": "rules/governance-router.md",
      "summary": "Any true or unknown fast-path exclusion requires full manifest routing."
    }
  ],
  "fast_path": {
    "eligible_modes": [
      "answer"
    ],
    "allowed_signals": [
      "durable_task"
    ],
    "excluded_signals": [
      "implementation_task",
      "operational_action",
      "existing_unfamiliar_code",
      "vague_material_requirement",
      "material_requirement_or_constraint",
      "complex_reasoning_or_state_model",
      "behavior_change",
      "test_logic_or_verification_change",
      "pure_refactor",
      "bug_or_regression",
      "architecture_or_public_boundary",
      "new_durable_boundary",
      "dependency_change",
      "supply_chain_change",
      "supply_chain_advisory_or_bounded_vulnerability",
      "supply_chain_vulnerability_or_compromise",
      "repository_code_execution",
      "unfamiliar_or_privileged_repository_execution",
      "untrusted_input_or_data_access",
      "established_security_boundary",
      "security_sensitive",
      "sensitive_data_handling",
      "privacy_lifecycle",
      "persisted_data",
      "schema_or_migration",
      "critical_data_integrity",
      "algorithmic_efficiency",
      "production_runtime_flow",
      "running_system_symptom",
      "recurring_or_bounded_operational_failure",
      "credible_high_impact_harm",
      "user_interface",
      "user_interface_with_data",
      "ai_product_behavior",
      "nontrivial_ai_assisted_work",
      "release_design_or_configuration",
      "production_readiness_assessment",
      "shared_environment_release_execution",
      "artifact_build_or_distribution",
      "configuration_or_feature_flag",
      "security_relevant_configuration",
      "deprecation_or_replacement",
      "external_side_effect",
      "destructive_or_irreversible_action",
      "material_public_communication",
      "bounded_credential_or_permission_action",
      "credential_permission_financial_or_legal_action",
      "production_incident_change",
      "product_domain_discovery",
      "major_project_uncertainty",
      "api_contract",
      "database_design",
      "distributed_system",
      "platform_infrastructure",
      "quality_strategy",
      "active_incident_coordination",
      "cross_team_technical_leadership",
      "documentation_stewardship",
      "formal_assurance"
    ],
    "exclusion_checks": [
      "The request needs repository, project, environment, current-state, or specialist context.",
      "The request may change code, behavior, contracts, data, UI, configuration, dependencies, artifacts, or runtime state.",
      "Security, privacy, credentials, permissions, money, legal effect, untrusted input, or credible high-impact harm may be involved.",
      "Execution, network access, an external or shared effect, production, destruction, or difficult recovery may be involved.",
      "The request is ambiguous enough that another routing signal may match."
    ],
    "policy_clause_ids": [
      "mode-bounds-actions",
      "evidence-scope",
      "delivery-status-separation",
      "unknown-requires-full-route"
    ],
    "fallback_on_unknown": true
  },
  "rules": [
    {
      "name": "adversarial-self-review",
      "path": "rules/adversarial-self-review.md"
    },
    {
      "name": "agent-operation-safety",
      "path": "rules/agent-operation-safety.md"
    },
    {
      "name": "ai-provenance-disclosure",
      "path": "rules/ai-provenance-disclosure.md"
    },
    {
      "name": "ai-system-safety",
      "path": "rules/ai-system-safety.md"
    },
    {
      "name": "algorithmic-efficiency-gate",
      "path": "rules/algorithmic-efficiency-gate.md"
    },
    {
      "name": "complexity-budget",
      "path": "rules/complexity-budget.md"
    },
    {
      "name": "configuration-and-feature-flags",
      "path": "rules/configuration-and-feature-flags.md"
    },
    {
      "name": "context-budget",
      "path": "rules/context-budget.md"
    },
    {
      "name": "data-integrity-and-migrations",
      "path": "rules/data-integrity-and-migrations.md"
    },
    {
      "name": "evolutionary-stewardship",
      "path": "rules/evolutionary-stewardship.md"
    },
    {
      "name": "failure-mode-catalog",
      "path": "rules/failure-mode-catalog.md"
    },
    {
      "name": "governance-router",
      "path": "rules/governance-router.md"
    },
    {
      "name": "implementation-execution-protocol",
      "path": "rules/implementation-execution-protocol.md"
    },
    {
      "name": "interface-and-accessibility-gate",
      "path": "rules/interface-and-accessibility-gate.md"
    },
    {
      "name": "observability-by-design",
      "path": "rules/observability-by-design.md"
    },
    {
      "name": "operational-resilience",
      "path": "rules/operational-resilience.md"
    },
    {
      "name": "production-readiness-gate",
      "path": "rules/production-readiness-gate.md"
    },
    {
      "name": "requirements-precision-gate",
      "path": "rules/requirements-precision-gate.md"
    },
    {
      "name": "security-and-privacy-gate",
      "path": "rules/security-and-privacy-gate.md"
    },
    {
      "name": "supply-chain-and-build-integrity",
      "path": "rules/supply-chain-and-build-integrity.md"
    },
    {
      "name": "testing-strategy",
      "path": "rules/testing-strategy.md"
    }
  ],
  "skills": [
    {